name,position,id,location,manager,email,fill,stroke,refs,url,image
Big five personality prediction based in Indonesian tweets using machine learning methods,2022,70,,,https://www.scopus.com/inward/record.uri?eid=2-s2.0-85122796837&doi=10.11591%2fijece.v12i2.pp1973-1981&partnerID=40&md5=87f376faaad330a69e7845bbff2e6856,#d5e8d4,#82b366,,https://app.diagrams.net,
My Tweets Bring All the Traits to the Yard: Predicting Personality and Relational Traits in Online Social Networks,2022,71,,,https://www.scopus.com/inward/record.uri?eid=2-s2.0-85131120158&doi=10.1145%2f3523749&partnerID=40&md5=f11a139c4da58bb79e5648cf649304f3,#d5e8d4,#82b366,,https://app.diagrams.net,
Multi-label personality trait identification from text,2022,72,,,https://www.scopus.com/inward/record.uri?eid=2-s2.0-85126330968&doi=10.1007%2fs11042-022-12548-1&partnerID=40&md5=0b985d72d75a1aeabefd636c910c6ad9,#d5e8d4,#82b366,,https://app.diagrams.net,
Regional personality assessment through social media language,2022,73,,,https://www.scopus.com/inward/record.uri?eid=2-s2.0-85116819278&doi=10.1111%2fjopy.12674&partnerID=40&md5=410734d4be978311676aae39a0e193c3,#d5e8d4,#82b366,,https://app.diagrams.net,
Using Natural Language Processing to Identify Effective Influencers,2022,74,,,https://www.scopus.com/inward/record.uri?eid=2-s2.0-85136918195&doi=10.1177%2f14707853221101565&partnerID=40&md5=5aaa9b2fd3b428a630e011bad7212dfc,#d5e8d4,#82b366,,https://app.diagrams.net,